{"generated_at":"2042-03-14T03:00:00+00:00","items":[{"attributes":{"color":"Đen","size":"M"},"audience":"Nam","availability":{"nguyen_trai":"out_of_stock","tam_coc":"in_stock","ton_that_thiep":"in_stock"},"category":"Áo","code":"SYNTHETIC-001","collection":null,"data_as_of":"2042-03-14T02:00:00+00:00","display_order":1,"featured":false,"images":["https://example.invalid/catalog/synthetic-001.jpg"],"name":"Sản phẩm minh họa","price_status":"available","sale_price":299000,"slug":"synthetic-001","source_group":"Synthetic"}],"schema_version":"the_gate_website_catalog.v1","source_data_as_of":"2042-03-14T02:00:00+00:00","total":1}
